2023-12-21 04:04:57,fe80::6c9b:9e0d:591c:fc8a,fe80::813f:cb21:c6d4:b7c2,193,Ether / IPv6 / TCP fe80::6c9b:9e0d:591c:fc8a:52574 > fe80::813f:cb21:c6d4:b7c2:49152 PA / Raw,52574,49152,TCP,bad
2023-12-21 04:04:57,fe80::813f:cb21:c6d4:b7c2,fe80::6c9b:9e0d:591c:fc8a,177,Ether / IPv6 / TCP fe80::813f:cb21:c6d4:b7c2:49152 > fe80::6c9b:9e0d:591c:fc8a:52574 PA / Raw,49152,52574,TCP,bad
2023-12-21 04:04:57,fe80::6c9b:9e0d:591c:fc8a,fe80::813f:cb21:c6d4:b7c2,193,Ether / IPv6 / TCP fe80::6c9b:9e0d:591c:fc8a:52574 > fe80::813f:cb21:c6d4:b7c2:49152 PA / Raw,52574,49152,TCP,bad
2023-12-21 04:04:57,fe80::813f:cb21:c6d4:b7c2,fe80::6c9b:9e0d:591c:fc8a,177,Ether / IPv6 / TCP fe80::813f:cb21:c6d4:b7c2:49152 > fe80::6c9b:9e0d:591c:fc8a:52574 PA / Raw,49152,52574,TCP,bad
2023-12-21 04:04:57,fe80::6c9b:9e0d:591c:fc8a,fe80::813f:cb21:c6d4:b7c2,193,Ether / IPv6 / TCP fe80::6c9b:9e0d:591c:fc8a:52574 > fe80::813f:cb21:c6d4:b7c2:49152 PA / Raw,52574,49152,TCP,bad
2023-12-21 04:04:57,fe80::813f:cb21:c6d4:b7c2,fe80::6c9b:9e0d:591c:fc8a,177,Ether / IPv6 / TCP fe80::813f:cb21:c6d4:b7c2:49152 > fe80::6c9b:9e0d:591c:fc8a:52574 PA / Raw,49152,52574,TCP,bad
2023-12-21 04:04:57,dc:a6:32:c9:e5:5e,dc:a6:32:c9:e6:9f,ARP,60,Ether / ARP is at dc:a6:32:c9:e5:5e says 192.168.10.2 / Padding,UnKnow,UnKnow,bad
2023-12-21 04:04:57,fe80::6c9b:9e0d:591c:fc8a,fe80::813f:cb21:c6d4:b7c2,193,Ether / IPv6 / TCP fe80::6c9b:9e0d:591c:fc8a:52574 > fe80::813f:cb21:c6d4:b7c2:49152 PA / Raw,52574,49152,TCP,bad
2023-12-21 04:04:57,fe80::813f:cb21:c6d4:b7c2,fe80::6c9b:9e0d:591c:fc8a,86,Ether / IPv6 / TCP fe80::813f:cb21:c6d4:b7c2:49152 > fe80::6c9b:9e0d:591c:fc8a:52574 A,49152,52574,TCP,bad
2023-12-21 04:04:57,fe80::813f:cb21:c6d4:b7c2,fe80::6c9b:9e0d:591c:fc8a,177,Ether / IPv6 / TCP fe80::813f:cb21:c6d4:b7c2:49152 > fe80::6c9b:9e0d:591c:fc8a:52574 PA / Raw,49152,52574,TCP,bad
2023-12-21 04:04:57,fe80::6c9b:9e0d:591c:fc8a,fe80::813f:cb21:c6d4:b7c2,193,Ether / IPv6 / TCP fe80::6c9b:9e0d:591c:fc8a:52574 > fe80::813f:cb21:c6d4:b7c2:49152 PA / Raw,52574,49152,TCP,bad
2023-12-21 04:04:57,fe80::813f:cb21:c6d4:b7c2,fe80::6c9b:9e0d:591c:fc8a,86,Ether / IPv6 / TCP fe80::813f:cb21:c6d4:b7c2:49152 > fe80::6c9b:9e0d:591c:fc8a:52574 A,49152,52574,TCP,bad
2023-12-21 04:04:57,192.168.10.4,192.168.10.2,60,Ether / IP / TCP 192.168.10.4:55760 > 192.168.10.2:pop3s S / Padding,55760,995,POPS3,bad
2023-12-21 04:04:57,192.168.10.4,192.168.10.2,60,Ether / IP / TCP 192.168.10.4:55760 > 192.168.10.2:epmap S / Padding,55760,135,TCP,bad
2023-12-21 04:04:57,192.168.10.4,192.168.10.2,60,Ether / IP / TCP 192.168.10.4:55760 > 192.168.10.2:3306 S / Padding,55760,3306,MySQL,bad
2023-12-21 04:04:57,192.168.10.4,192.168.10.2,60,Ether / IP / TCP 192.168.10.4:55760 > 192.168.10.2:199 S / Padding,55760,199,SMUX,bad
2023-12-21 04:04:57,192.168.10.4,192.168.10.2,60,Ether / IP / TCP 192.168.10.4:55760 > 192.168.10.2:telnet S / Padding,55760,23,Telnet,bad
2023-12-21 04:04:57,192.168.10.4,192.168.10.2,60,Ether / IP / TCP 192.168.10.4:55760 > 192.168.10.2:5900 S / Padding,55760,5900,TCP,bad
2023-12-21 04:04:57,192.168.10.4,192.168.10.2,60,Ether / IP / TCP 192.168.10.4:55760 > 192.168.10.2:587 S / Padding,55760,587,MSA,bad
2023-12-21 04:04:57,192.168.10.4,192.168.10.2,60,Ether / IP / TCP 192.168.10.4:55760 > 192.168.10.2:auth S / Padding,55760,113,Auth,bad
2023-12-21 04:04:57,192.168.10.2,192.168.10.4,60,Ether / IP / TCP 192.168.10.2:pop3s > 192.168.10.4:55760 RA / Padding,995,55760,POPS3,bad
2023-12-21 04:04:57,192.168.10.4,192.168.10.2,60,Ether / IP / TCP 192.168.10.4:55760 > 192.168.10.2:8888 S / Padding,55760,8888,TCP,bad
2023-12-21 04:04:57,192.168.10.4,192.168.10.2,60,Ether / IP / TCP 192.168.10.4:55760 > 192.168.10.2:pptp S / Padding,55760,1723,TCP,bad
2023-12-21 04:04:57,192.168.10.2,192.168.10.4,60,Ether / IP / TCP 192.168.10.2:epmap > 192.168.10.4:55760 RA / Padding,135,55760,TCP,bad
2023-12-21 04:04:57,192.168.10.2,192.168.10.4,60,Ether / IP / TCP 192.168.10.2:3306 > 192.168.10.4:55760 RA / Padding,3306,55760,MySQL,bad
2023-12-21 04:04:57,192.168.10.2,192.168.10.4,60,Ether / IP / TCP 192.168.10.2:199 > 192.168.10.4:55760 RA / Padding,199,55760,SMUX,bad
2023-12-21 04:04:57,192.168.10.2,192.168.10.4,60,Ether / IP / TCP 192.168.10.2:telnet > 192.168.10.4:55760 RA / Padding,23,55760,Telnet,bad
2023-12-21 04:04:57,192.168.10.2,192.168.10.4,60,Ether / IP / TCP 192.168.10.2:5900 > 192.168.10.4:55760 RA / Padding,5900,55760,TCP,bad
2023-12-21 04:04:57,192.168.10.2,192.168.10.4,60,Ether / IP / TCP 192.168.10.2:587 > 192.168.10.4:55760 RA / Padding,587,55760,MSA,bad
2023-12-21 04:04:57,192.168.10.2,192.168.10.4,60,Ether / IP / TCP 192.168.10.2:auth > 192.168.10.4:55760 RA / Padding,113,55760,Auth,bad
2023-12-21 04:04:57,192.168.10.2,192.168.10.4,60,Ether / IP / TCP 192.168.10.2:8888 > 192.168.10.4:55760 RA / Padding,8888,55760,TCP,bad
2023-12-21 04:04:57,192.168.10.2,192.168.10.4,60,Ether / IP / TCP 192.168.10.2:pptp > 192.168.10.4:55760 RA / Padding,1723,55760,TCP,bad
2023-12-21 04:04:57,192.168.10.4,192.168.10.2,60,Ether / IP / TCP 192.168.10.4:55760 > 192.168.10.2:1025 S / Padding,55760,1025,Network Blackjack,bad
2023-12-21 04:04:57,192.168.10.4,192.168.10.2,60,Ether / IP / TCP 192.168.10.4:55760 > 192.168.10.2:imap S / Padding,55760,143,IMAP,bad
2023-12-21 04:04:57,192.168.10.4,192.168.10.2,60,Ether / IP / TCP 192.168.10.4:55760 > 192.168.10.2:1720 S / Padding,55760,1720,H323hostcall,bad
2023-12-21 04:04:57,192.168.10.4,192.168.10.2,60,Ether / IP / TCP 192.168.10.4:55760 > 192.168.10.2:256 S / Padding,55760,256,TCP,bad
2023-12-21 04:04:57,192.168.10.4,192.168.10.2,60,Ether / IP / TCP 192.168.10.4:55760 > 192.168.10.2:domain S / Padding,55760,53,DNS,bad
2023-12-21 04:04:57,192.168.10.4,192.168.10.2,60,Ether / IP / TCP 192.168.10.4:55760 > 192.168.10.2:ftp S / Padding,55760,21,FTP,bad
2023-12-21 04:04:57,192.168.10.4,192.168.10.2,60,Ether / IP / TCP 192.168.10.4:55760 > 192.168.10.2:imaps S / Padding,55760,993,IMAPS,bad
2023-12-21 04:04:57,192.168.10.2,192.168.10.4,60,Ether / IP / TCP 192.168.10.2:1025 > 192.168.10.4:55760 RA / Padding,1025,55760,Network Blackjack,bad
2023-12-21 04:04:57,192.168.10.4,192.168.10.2,60,Ether / IP / TCP 192.168.10.4:55760 > 192.168.10.2:rtsp S / Padding,55760,554,RTSP,bad
2023-12-21 04:04:57,192.168.10.4,192.168.10.2,60,Ether / IP / TCP 192.168.10.4:55760 > 192.168.10.2:https S / Padding,55760,443,HTTPS,bad
2023-12-21 04:04:57,192.168.10.4,192.168.10.2,60,Ether / IP / TCP 192.168.10.4:55760 > 192.168.10.2:pop3 S / Padding,55760,110,POP3,bad
2023-12-21 04:04:57,192.168.10.4,192.168.10.2,60,Ether / IP / TCP 192.168.10.4:55760 > 192.168.10.2:microsoft_ds S / Padding,55760,445,SMB,bad
2023-12-21 04:04:57,192.168.10.2,192.168.10.4,60,Ether / IP / TCP 192.168.10.2:imap > 192.168.10.4:55760 RA / Padding,143,55760,IMAP,bad
2023-12-21 04:04:57,192.168.10.4,192.168.10.2,60,Ether / IP / TCP 192.168.10.4:55760 > 192.168.10.2:smtp S / Padding,55760,25,SMTP,bad
2023-12-21 04:04:57,192.168.10.2,192.168.10.4,60,Ether / IP / TCP 192.168.10.2:1720 > 192.168.10.4:55760 RA / Padding,1720,55760,H323hostcall,bad
2023-12-21 04:04:57,192.168.10.2,192.168.10.4,60,Ether / IP / TCP 192.168.10.2:256 > 192.168.10.4:55760 RA / Padding,256,55760,TCP,bad
2023-12-21 04:04:57,192.168.10.4,192.168.10.2,60,Ether / IP / TCP 192.168.10.4:55760 > 192.168.10.2:8080 S / Padding,55760,8080,WebCache,bad
2023-12-21 04:04:57,192.168.10.2,192.168.10.4,60,Ether / IP / TCP 192.168.10.2:domain > 192.168.10.4:55760 RA / Padding,53,55760,DNS,bad
2023-12-21 04:04:57,192.168.10.4,192.168.10.2,60,Ether / IP / TCP 192.168.10.4:55760 > 192.168.10.2:http S / Padding,55760,80,HTTP,bad
2023-12-21 04:04:57,192.168.10.2,192.168.10.4,60,Ether / IP / TCP 192.168.10.2:ftp > 192.168.10.4:55760 RA / Padding,21,55760,FTP,bad
2023-12-21 04:04:57,192.168.10.2,192.168.10.4,60,Ether / IP / TCP 192.168.10.2:imaps > 192.168.10.4:55760 RA / Padding,993,55760,IMAPS,bad
2023-12-21 04:04:57,192.168.10.4,192.168.10.2,60,Ether / IP / TCP 192.168.10.4:55760 > 192.168.10.2:netbios_ssn S / Padding,55760,139,Netbios-Ssn,bad
2023-12-21 04:04:57,192.168.10.2,192.168.10.4,60,Ether / IP / TCP 192.168.10.2:rtsp > 192.168.10.4:55760 RA / Padding,554,55760,RTSP,bad
2023-12-21 04:04:57,192.168.10.4,192.168.10.2,60,Ether / IP / TCP 192.168.10.4:55760 > 192.168.10.2:ssh S / Padding,55760,22,SSH,bad
2023-12-21 04:04:57,192.168.10.4,192.168.10.2,60,Ether / IP / TCP 192.168.10.4:55760 > 192.168.10.2:sunrpc S / Padding,55760,111,SunRPC,bad
2023-12-21 04:04:57,192.168.10.4,192.168.10.2,60,Ether / IP / TCP 192.168.10.4:55760 > 192.168.10.2:ms_wbt_server S / Padding,55760,3389,TCP,bad
2023-12-21 04:04:57,192.168.10.4,192.168.10.2,60,Ether / IP / TCP 192.168.10.4:55760 > 192.168.10.2:kpasswd S / Padding,55760,464,Kpasswd,bad
2023-12-21 04:04:57,192.168.10.2,192.168.10.4,60,Ether / IP / TCP 192.168.10.2:https > 192.168.10.4:55760 RA / Padding,443,55760,HTTPS,bad
2023-12-21 04:04:57,192.168.10.4,192.168.10.2,60,Ether / IP / TCP 192.168.10.4:55760 > 192.168.10.2:6007 S / Padding,55760,6007,TCP,bad
2023-12-21 04:04:57,192.168.10.2,192.168.10.4,60,Ether / IP / TCP 192.168.10.2:pop3 > 192.168.10.4:55760 RA / Padding,110,55760,POP3,bad
2023-12-21 04:04:57,192.168.10.2,192.168.10.4,60,Ether / IP / TCP 192.168.10.2:microsoft_ds > 192.168.10.4:55760 RA / Padding,445,55760,SMB,bad
2023-12-21 04:04:57,192.168.10.2,192.168.10.4,60,Ether / IP / TCP 192.168.10.2:smtp > 192.168.10.4:55760 RA / Padding,25,55760,SMTP,bad
2023-12-21 04:04:57,192.168.10.2,192.168.10.4,60,Ether / IP / TCP 192.168.10.2:8080 > 192.168.10.4:55760 RA / Padding,8080,55760,WebCache,bad
2023-12-21 04:04:57,192.168.10.2,192.168.10.4,60,Ether / IP / TCP 192.168.10.2:http > 192.168.10.4:55760 RA / Padding,80,55760,HTTP,bad
2023-12-21 04:04:57,192.168.10.2,192.168.10.4,60,Ether / IP / TCP 192.168.10.2:netbios_ssn > 192.168.10.4:55760 RA / Padding,139,55760,Netbios-Ssn,bad
2023-12-21 04:04:57,192.168.10.2,192.168.10.4,60,Ether / IP / TCP 192.168.10.2:ssh > 192.168.10.4:55760 SA / Padding,22,55760,SSH,bad
2023-12-21 04:04:57,192.168.10.2,192.168.10.4,60,Ether / IP / TCP 192.168.10.2:sunrpc > 192.168.10.4:55760 RA / Padding,111,55760,SunRPC,bad
2023-12-21 04:04:57,192.168.10.2,192.168.10.4,60,Ether / IP / TCP 192.168.10.2:ms_wbt_server > 192.168.10.4:55760 RA / Padding,3389,55760,TCP,bad
2023-12-21 04:04:57,192.168.10.2,192.168.10.4,60,Ether / IP / TCP 192.168.10.2:kpasswd > 192.168.10.4:55760 RA / Padding,464,55760,Kpasswd,bad
2023-12-21 04:04:57,192.168.10.2,192.168.10.4,60,Ether / IP / TCP 192.168.10.2:6007 > 192.168.10.4:55760 RA / Padding,6007,55760,TCP,bad
2023-12-21 04:04:57,192.168.10.4,192.168.10.2,60,Ether / IP / TCP 192.168.10.4:55760 > 192.168.10.2:ssh R / Padding,55760,22,SSH,bad
2023-12-21 04:04:57,192.168.10.4,192.168.10.2,60,Ether / IP / TCP 192.168.10.4:55760 > 192.168.10.2:15004 S / Padding,55760,15004,TCP,bad
2023-12-21 04:04:57,192.168.10.4,192.168.10.2,60,Ether / IP / TCP 192.168.10.4:55760 > 192.168.10.2:8087 S / Padding,55760,8087,TCP,bad
2023-12-21 04:04:57,192.168.10.4,192.168.10.2,60,Ether / IP / TCP 192.168.10.4:55760 > 192.168.10.2:50006 S / Padding,55760,50006,TCP,bad
2023-12-21 04:04:57,192.168.10.4,192.168.10.2,60,Ether / IP / TCP 192.168.10.4:55760 > 192.168.10.2:32778 S / Padding,55760,32778,TCP,bad
2023-12-21 04:04:57,192.168.10.4,192.168.10.2,60,Ether / IP / TCP 192.168.10.4:55760 > 192.168.10.2:10566 S / Padding,55760,10566,TCP,bad
2023-12-21 04:04:57,192.168.10.4,192.168.10.2,60,Ether / IP / TCP 192.168.10.4:55760 > 192.168.10.2:5810 S / Padding,55760,5810,TCP,bad
2023-12-21 04:04:57,192.168.10.2,192.168.10.4,60,Ether / IP / TCP 192.168.10.2:15004 > 192.168.10.4:55760 RA / Padding,15004,55760,TCP,bad
2023-12-21 04:04:57,192.168.10.4,192.168.10.2,60,Ether / IP / TCP 192.168.10.4:55760 > 192.168.10.2:8081 S / Padding,55760,8081,Tproxy,bad
2023-12-21 04:04:57,192.168.10.4,192.168.10.2,60,Ether / IP / TCP 192.168.10.4:55760 > 192.168.10.2:6123 S / Padding,55760,6123,TCP,bad
2023-12-21 04:04:57,192.168.10.4,192.168.10.2,60,Ether / IP / TCP 192.168.10.4:55760 > 192.168.10.2:2035 S / Padding,55760,2035,TCP,bad
2023-12-21 04:04:57,192.168.10.4,192.168.10.2,60,Ether / IP / TCP 192.168.10.4:55760 > 192.168.10.2:3372 S / Padding,55760,3372,TCP,bad
2023-12-21 04:04:57,192.168.10.4,192.168.10.2,60,Ether / IP / TCP 192.168.10.4:55760 > 192.168.10.2:14441 S / Padding,55760,14441,TCP,bad
2023-12-21 04:04:57,192.168.10.2,192.168.10.4,60,Ether / IP / TCP 192.168.10.2:8087 > 192.168.10.4:55760 RA / Padding,8087,55760,TCP,bad
2023-12-21 04:04:57,192.168.10.4,192.168.10.2,60,Ether / IP / TCP 192.168.10.4:55760 > 192.168.10.2:19315 S / Padding,55760,19315,TCP,bad
2023-12-21 04:04:57,192.168.10.2,192.168.10.4,60,Ether / IP / TCP 192.168.10.2:50006 > 192.168.10.4:55760 RA / Padding,50006,55760,TCP,bad
2023-12-21 04:04:57,192.168.10.2,192.168.10.4,60,Ether / IP / TCP 192.168.10.2:32778 > 192.168.10.4:55760 RA / Padding,32778,55760,TCP,bad
2023-12-21 04:04:57,192.168.10.4,192.168.10.2,60,Ether / IP / TCP 192.168.10.4:55760 > 192.168.10.2:6789 S / Padding,55760,6789,TCP,bad
2023-12-21 04:04:57,192.168.10.2,192.168.10.4,60,Ether / IP / TCP 192.168.10.2:10566 > 192.168.10.4:55760 RA / Padding,10566,55760,TCP,bad
2023-12-21 04:04:57,192.168.10.2,192.168.10.4,60,Ether / IP / TCP 192.168.10.2:5810 > 192.168.10.4:55760 RA / Padding,5810,55760,TCP,bad
2023-12-21 04:04:57,192.168.10.4,192.168.10.2,60,Ether / IP / TCP 192.168.10.4:55760 > 192.168.10.2:1805 S / Padding,55760,1805,TCP,bad
2023-12-21 04:04:57,192.168.10.2,192.168.10.4,60,Ether / IP / TCP 192.168.10.2:8081 > 192.168.10.4:55760 RA / Padding,8081,55760,Tproxy,bad
2023-12-21 04:04:57,192.168.10.2,192.168.10.4,60,Ether / IP / TCP 192.168.10.2:6123 > 192.168.10.4:55760 RA / Padding,6123,55760,TCP,bad
2023-12-21 04:04:57,192.168.10.4,192.168.10.2,60,Ether / IP / TCP 192.168.10.4:55760 > 192.168.10.2:50003 S / Padding,55760,50003,TCP,bad
2023-12-21 04:04:57,192.168.10.4,192.168.10.2,60,Ether / IP / TCP 192.168.10.4:55760 > 192.168.10.2:49999 S / Padding,55760,49999,TCP,bad
2023-12-21 04:04:57,192.168.10.4,192.168.10.2,60,Ether / IP / TCP 192.168.10.4:55760 > 192.168.10.2:617 S / Padding,55760,617,TCP,bad
2023-12-21 04:04:57,192.168.10.4,192.168.10.2,60,Ether / IP / TCP 192.168.10.4:55760 > 192.168.10.2:3325 S / Padding,55760,3325,TCP,bad
2023-12-21 04:04:57,192.168.10.4,192.168.10.2,60,Ether / IP / TCP 192.168.10.4:55760 > 192.168.10.2:2875 S / Padding,55760,2875,TCP,bad
2023-12-21 04:04:57,192.168.10.4,192.168.10.2,60,Ether / IP / TCP 192.168.10.4:55760 > 192.168.10.2:kshell S / Padding,55760,544,Kshell,bad
2023-12-21 04:04:57,192.168.10.4,192.168.10.2,60,Ether / IP / TCP 192.168.10.4:55760 > 192.168.10.2:ms_sql_m S / Padding,55760,1434,Ms-SQL-M,bad
2023-12-21 04:04:57,192.168.10.4,192.168.10.2,60,Ether / IP / TCP 192.168.10.4:55760 > 192.168.10.2:10626 S / Padding,55760,10626,TCP,bad
2023-12-21 04:04:57,192.168.10.4,192.168.10.2,60,Ether / IP / TCP 192.168.10.4:55760 > 192.168.10.2:1007 S / Padding,55760,1007,TCP,bad
2023-12-21 04:04:57,192.168.10.4,192.168.10.2,60,Ether / IP / TCP 192.168.10.4:55760 > 192.168.10.2:1058 S / Padding,55760,1058,TCP,bad
2023-12-21 04:04:57,192.168.10.4,192.168.10.2,60,Ether / IP / TCP 192.168.10.4:55760 > 192.168.10.2:18040 S / Padding,55760,18040,TCP,bad
2023-12-21 04:04:57,192.168.10.4,192.168.10.2,60,Ether / IP / TCP 192.168.10.4:55760 > 192.168.10.2:activesync S / Padding,55760,1034,TCP,bad
2023-12-21 04:04:57,192.168.10.4,192.168.10.2,60,Ether / IP / TCP 192.168.10.4:55760 > 192.168.10.2:1107 S / Padding,55760,1107,TCP,bad
2023-12-21 04:04:57,192.168.10.2,192.168.10.4,60,Ether / IP / TCP 192.168.10.2:2035 > 192.168.10.4:55760 RA / Padding,2035,55760,TCP,bad
2023-12-21 04:04:57,192.168.10.4,192.168.10.2,60,Ether / IP / TCP 192.168.10.4:55760 > 192.168.10.2:2909 S / Padding,55760,2909,TCP,bad
2023-12-21 04:04:57,192.168.10.2,192.168.10.4,60,Ether / IP / TCP 192.168.10.2:3372 > 192.168.10.4:55760 RA / Padding,3372,55760,TCP,bad
2023-12-21 04:04:57,192.168.10.2,192.168.10.4,60,Ether / IP / TCP 192.168.10.2:14441 > 192.168.10.4:55760 RA / Padding,14441,55760,TCP,bad
2023-12-21 04:04:57,192.168.10.4,192.168.10.2,60,Ether / IP / TCP 192.168.10.4:55760 > 192.168.10.2:254 S / Padding,55760,254,TCP,bad
2023-12-21 04:04:57,192.168.10.2,192.168.10.4,60,Ether / IP / TCP 192.168.10.2:19315 > 192.168.10.4:55760 RA / Padding,19315,55760,TCP,bad
2023-12-21 04:04:57,192.168.10.2,192.168.10.4,60,Ether / IP / TCP 192.168.10.2:6789 > 192.168.10.4:55760 RA / Padding,6789,55760,TCP,bad
2023-12-21 04:04:57,192.168.10.2,192.168.10.4,60,Ether / IP / TCP 192.168.10.2:1805 > 192.168.10.4:55760 RA / Padding,1805,55760,TCP,bad
2023-12-21 04:04:57,192.168.10.4,192.168.10.2,60,Ether / IP / TCP 192.168.10.4:55760 > 192.168.10.2:4567 S / Padding,55760,4567,TCP,bad
2023-12-21 04:04:57,192.168.10.2,192.168.10.4,60,Ether / IP / TCP 192.168.10.2:50003 > 192.168.10.4:55760 RA / Padding,50003,55760,TCP,bad
2023-12-21 04:04:57,192.168.10.4,192.168.10.2,60,Ether / IP / TCP 192.168.10.4:55760 > 192.168.10.2:27715 S / Padding,55760,27715,TCP,bad
2023-12-21 04:04:57,192.168.10.4,192.168.10.2,60,Ether / IP / TCP 192.168.10.4:55760 > 192.168.10.2:2033 S / Padding,55760,2033,TCP,bad
2023-12-21 04:04:57,192.168.10.4,192.168.10.2,60,Ether / IP / TCP 192.168.10.4:55760 > 192.168.10.2:7627 S / Padding,55760,7627,TCP,bad
2023-12-21 04:04:57,192.168.10.4,192.168.10.2,60,Ether / IP / TCP 192.168.10.4:55760 > 192.168.10.2:8086 S / Padding,55760,8086,TCP,bad
2023-12-21 04:04:57,192.168.10.4,192.168.10.2,60,Ether / IP / TCP 192.168.10.4:55760 > 192.168.10.2:2401 S / Padding,55760,2401,Cvspserver,bad
2023-12-21 04:04:57,192.168.10.2,192.168.10.4,60,Ether / IP / TCP 192.168.10.2:49999 > 192.168.10.4:55760 RA / Padding,49999,55760,TCP,bad
2023-12-21 04:04:57,192.168.10.4,192.168.10.2,60,Ether / IP / TCP 192.168.10.4:55760 > 192.168.10.2:8651 S / Padding,55760,8651,TCP,bad
2023-12-21 04:04:57,192.168.10.2,192.168.10.4,60,Ether / IP / TCP 192.168.10.2:617 > 192.168.10.4:55760 RA / Padding,617,55760,TCP,bad
2023-12-21 04:04:57,192.168.10.2,192.168.10.4,60,Ether / IP / TCP 192.168.10.2:3325 > 192.168.10.4:55760 RA / Padding,3325,55760,TCP,bad
2023-12-21 04:04:57,192.168.10.4,192.168.10.2,60,Ether / IP / TCP 192.168.10.4:55760 > 192.168.10.2:5925 S / Padding,55760,5925,TCP,bad
2023-12-21 04:04:57,192.168.10.2,192.168.10.4,60,Ether / IP / TCP 192.168.10.2:2875 > 192.168.10.4:55760 RA / Padding,2875,55760,TCP,bad
2023-12-21 04:04:57,192.168.10.2,192.168.10.4,60,Ether / IP / TCP 192.168.10.2:kshell > 192.168.10.4:55760 RA / Padding,544,55760,Kshell,bad
2023-12-21 04:04:57,192.168.10.4,192.168.10.2,60,Ether / IP / TCP 192.168.10.4:55760 > 192.168.10.2:9090 S / Padding,55760,9090,TCP,bad
2023-12-21 04:04:57,192.168.10.2,192.168.10.4,60,Ether / IP / TCP 192.168.10.2:ms_sql_m > 192.168.10.4:55760 RA / Padding,1434,55760,Ms-SQL-M,bad
2023-12-21 04:04:57,192.168.10.2,192.168.10.4,60,Ether / IP / TCP 192.168.10.2:10626 > 192.168.10.4:55760 RA / Padding,10626,55760,TCP,bad
2023-12-21 04:04:57,192.168.10.4,192.168.10.2,60,Ether / IP / TCP 192.168.10.4:55760 > 192.168.10.2:6668 S / Padding,55760,6668,TCP,bad
2023-12-21 04:04:57,192.168.10.2,192.168.10.4,60,Ether / IP / TCP 192.168.10.2:1007 > 192.168.10.4:55760 RA / Padding,1007,55760,TCP,bad
2023-12-21 04:04:57,192.168.10.4,192.168.10.2,60,Ether / IP / TCP 192.168.10.4:55760 > 192.168.10.2:1271 S / Padding,55760,1271,TCP,bad
2023-12-21 04:04:57,192.168.10.2,192.168.10.4,60,Ether / IP / TCP 192.168.10.2:1058 > 192.168.10.4:55760 RA / Padding,1058,55760,TCP,bad
2023-12-21 04:04:57,192.168.10.2,192.168.10.4,60,Ether / IP / TCP 192.168.10.2:18040 > 192.168.10.4:55760 RA / Padding,18040,55760,TCP,bad
2023-12-21 04:04:57,192.168.10.2,192.168.10.4,60,Ether / IP / TCP 192.168.10.2:activesync > 192.168.10.4:55760 RA / Padding,1034,55760,TCP,bad
2023-12-21 04:04:57,192.168.10.2,192.168.10.4,60,Ether / IP / TCP 192.168.10.2:1107 > 192.168.10.4:55760 RA / Padding,1107,55760,TCP,bad
2023-12-21 04:04:57,192.168.10.2,192.168.10.4,60,Ether / IP / TCP 192.168.10.2:2909 > 192.168.10.4:55760 RA / Padding,2909,55760,TCP,bad
2023-12-21 04:04:57,192.168.10.2,192.168.10.4,60,Ether / IP / TCP 192.168.10.2:254 > 192.168.10.4:55760 RA / Padding,254,55760,TCP,bad
2023-12-21 04:04:57,192.168.10.2,192.168.10.4,60,Ether / IP / TCP 192.168.10.2:4567 > 192.168.10.4:55760 RA / Padding,4567,55760,TCP,bad
2023-12-21 04:04:57,192.168.10.2,192.168.10.4,60,Ether / IP / TCP 192.168.10.2:27715 > 192.168.10.4:55760 RA / Padding,27715,55760,TCP,bad
2023-12-21 04:04:57,192.168.10.2,192.168.10.4,60,Ether / IP / TCP 192.168.10.2:2033 > 192.168.10.4:55760 RA / Padding,2033,55760,TCP,bad
2023-12-21 04:04:57,192.168.10.2,192.168.10.4,60,Ether / IP / TCP 192.168.10.2:7627 > 192.168.10.4:55760 RA / Padding,7627,55760,TCP,bad
2023-12-21 04:04:57,192.168.10.2,192.168.10.4,60,Ether / IP / TCP 192.168.10.2:8086 > 192.168.10.4:55760 RA / Padding,8086,55760,TCP,bad
2023-12-21 04:04:57,192.168.10.2,192.168.10.4,60,Ether / IP / TCP 192.168.10.2:2401 > 192.168.10.4:55760 RA / Padding,2401,55760,Cvspserver,bad
2023-12-21 04:04:57,192.168.10.2,192.168.10.4,60,Ether / IP / TCP 192.168.10.2:8651 > 192.168.10.4:55760 RA / Padding,8651,55760,TCP,bad
2023-12-21 04:04:57,192.168.10.2,192.168.10.4,60,Ether / IP / TCP 192.168.10.2:5925 > 192.168.10.4:55760 RA / Padding,5925,55760,TCP,bad
2023-12-21 04:04:57,192.168.10.2,192.168.10.4,60,Ether / IP / TCP 192.168.10.2:9090 > 192.168.10.4:55760 RA / Padding,9090,55760,TCP,bad
2023-12-21 04:04:57,192.168.10.2,192.168.10.4,60,Ether / IP / TCP 192.168.10.2:6668 > 192.168.10.4:55760 RA / Padding,6668,55760,TCP,bad
2023-12-21 04:04:57,192.168.10.2,192.168.10.4,60,Ether / IP / TCP 192.168.10.2:1271 > 192.168.10.4:55760 RA / Padding,1271,55760,TCP,bad
2023-12-21 04:04:57,192.168.10.4,192.168.10.2,60,Ether / IP / TCP 192.168.10.4:55760 > 192.168.10.2:668 S / Padding,55760,668,TCP,bad
2023-12-21 04:04:57,192.168.10.4,192.168.10.2,60,Ether / IP / TCP 192.168.10.4:55760 > 192.168.10.2:2001 S / Padding,55760,2001,TCP,bad
2023-12-21 04:04:57,192.168.10.4,192.168.10.2,60,Ether / IP / TCP 192.168.10.4:55760 > 192.168.10.2:5060 S / Padding,55760,5060,TCP,bad
2023-12-21 04:04:57,192.168.10.4,192.168.10.2,60,Ether / IP / TCP 192.168.10.4:55760 > 192.168.10.2:27356 S / Padding,55760,27356,TCP,bad
2023-12-21 04:04:57,192.168.10.4,192.168.10.2,60,Ether / IP / TCP 192.168.10.4:55760 > 192.168.10.2:4111 S / Padding,55760,4111,TCP,bad
2023-12-21 04:04:57,192.168.10.4,192.168.10.2,60,Ether / IP / TCP 192.168.10.4:55760 > 192.168.10.2:49156 S / Padding,55760,49156,TCP,bad
2023-12-21 04:04:57,192.168.10.4,192.168.10.2,60,Ether / IP / TCP 192.168.10.4:55760 > 192.168.10.2:3003 S / Padding,55760,3003,TCP,bad
2023-12-21 04:04:57,192.168.10.4,192.168.10.2,60,Ether / IP / TCP 192.168.10.4:55760 > 192.168.10.2:5101 S / Padding,55760,5101,TCP,bad
2023-12-21 04:04:57,192.168.10.4,192.168.10.2,60,Ether / IP / TCP 192.168.10.4:55760 > 192.168.10.2:5054 S / Padding,55760,5054,TCP,bad
2023-12-21 04:04:57,192.168.10.4,192.168.10.2,60,Ether / IP / TCP 192.168.10.4:55760 > 192.168.10.2:5903 S / Padding,55760,5903,TCP,bad
2023-12-21 04:04:57,192.168.10.4,192.168.10.2,60,Ether / IP / TCP 192.168.10.4:55760 > 192.168.10.2:56738 S / Padding,55760,56738,TCP,bad
2023-12-21 04:04:57,192.168.10.4,192.168.10.2,60,Ether / IP / TCP 192.168.10.4:55760 > 192.168.10.2:1067 S / Padding,55760,1067,TCP,bad
2023-12-21 04:04:57,192.168.10.2,192.168.10.4,60,Ether / IP / TCP 192.168.10.2:668 > 192.168.10.4:55760 RA / Padding,668,55760,TCP,bad
2023-12-21 04:04:57,192.168.10.4,192.168.10.2,60,Ether / IP / TCP 192.168.10.4:55760 > 192.168.10.2:1839 S / Padding,55760,1839,TCP,bad
2023-12-21 04:04:57,192.168.10.2,192.168.10.4,60,Ether / IP / TCP 192.168.10.2:2001 > 192.168.10.4:55760 RA / Padding,2001,55760,TCP,bad
2023-12-21 04:04:57,192.168.10.4,192.168.10.2,60,Ether / IP / TCP 192.168.10.4:55760 > 192.168.10.2:27352 S / Padding,55760,27352,TCP,bad
2023-12-21 04:04:57,192.168.10.4,192.168.10.2,60,Ether / IP / TCP 192.168.10.4:55760 > 192.168.10.2:6543 S / Padding,55760,6543,TCP,bad
2023-12-21 04:04:57,192.168.10.4,192.168.10.2,60,Ether / IP / TCP 192.168.10.4:55760 > 192.168.10.2:2021 S / Padding,55760,2021,TCP,bad
2023-12-21 04:04:57,192.168.10.4,192.168.10.2,60,Ether / IP / TCP 192.168.10.4:55760 > 192.168.10.2:2107 S / Padding,55760,2107,TCP,bad
2023-12-21 04:04:57,192.168.10.2,192.168.10.4,60,Ether / IP / TCP 192.168.10.2:5060 > 192.168.10.4:55760 RA / Padding,5060,55760,TCP,bad
2023-12-21 04:04:57,192.168.10.4,192.168.10.2,60,Ether / IP / TCP 192.168.10.4:55760 > 192.168.10.2:5431 S / Padding,55760,5431,TCP,bad
2023-12-21 04:04:57,192.168.10.2,192.168.10.4,60,Ether / IP / TCP 192.168.10.2:27356 > 192.168.10.4:55760 RA / Padding,27356,55760,TCP,bad
2023-12-21 04:04:57,192.168.10.2,192.168.10.4,60,Ether / IP / TCP 192.168.10.2:4111 > 192.168.10.4:55760 RA / Padding,4111,55760,TCP,bad
2023-12-21 04:04:57,192.168.10.2,192.168.10.4,60,Ether / IP / TCP 192.168.10.2:49156 > 192.168.10.4:55760 RA / Padding,49156,55760,TCP,bad
2023-12-21 04:04:57,192.168.10.4,192.168.10.2,60,Ether / IP / TCP 192.168.10.4:55760 > 192.168.10.2:458 S / Padding,55760,458,TCP,bad
2023-12-21 04:04:57,192.168.10.2,192.168.10.4,60,Ether / IP / TCP 192.168.10.2:3003 > 192.168.10.4:55760 RA / Padding,3003,55760,TCP,bad
2023-12-21 04:04:57,192.168.10.2,192.168.10.4,60,Ether / IP / TCP 192.168.10.2:5101 > 192.168.10.4:55760 RA / Padding,5101,55760,TCP,bad
2023-12-21 04:04:57,192.168.10.2,192.168.10.4,60,Ether / IP / TCP 192.168.10.2:5054 > 192.168.10.4:55760 RA / Padding,5054,55760,TCP,bad
2023-12-21 04:04:57,192.168.10.4,192.168.10.2,60,Ether / IP / TCP 192.168.10.4:55760 > 192.168.10.2:nntps S / Padding,55760,563,NNTPS,bad
2023-12-21 04:04:57,192.168.10.4,192.168.10.2,60,Ether / IP / TCP 192.168.10.4:55760 > 192.168.10.2:7911 S / Padding,55760,7911,TCP,bad
2023-12-21 04:04:57,192.168.10.2,192.168.10.4,60,Ether / IP / TCP 192.168.10.2:5903 > 192.168.10.4:55760 RA / Padding,5903,55760,TCP,bad
2023-12-21 04:04:57,192.168.10.4,192.168.10.2,60,Ether / IP / TCP 192.168.10.4:55760 > 192.168.10.2:30 S / Padding,55760,30,TCP,bad
2023-12-21 04:04:57,192.168.10.4,192.168.10.2,60,Ether / IP / TCP 192.168.10.4:55760 > 192.168.10.2:dccm S / Padding,55760,5679,TCP,bad
2023-12-21 04:04:57,192.168.10.2,192.168.10.4,60,Ether / IP / TCP 192.168.10.2:56738 > 192.168.10.4:55760 RA / Padding,56738,55760,TCP,bad
2023-12-21 04:04:57,192.168.10.4,192.168.10.2,60,Ether / IP / TCP 192.168.10.4:55760 > 192.168.10.2:gopher S / Padding,55760,70,Gopher,bad
2023-12-21 04:04:57,192.168.10.2,192.168.10.4,60,Ether / IP / TCP 192.168.10.2:1067 > 192.168.10.4:55760 RA / Padding,1067,55760,TCP,bad
2023-12-21 04:04:57,192.168.10.2,192.168.10.4,60,Ether / IP / TCP 192.168.10.2:1839 > 192.168.10.4:55760 RA / Padding,1839,55760,TCP,bad
2023-12-21 04:04:57,192.168.10.4,192.168.10.2,60,Ether / IP / TCP 192.168.10.4:55760 > 192.168.10.2:801 S / Padding,55760,801,TCP,bad
2023-12-21 04:04:57,192.168.10.4,192.168.10.2,60,Ether / IP / TCP 192.168.10.4:55760 > 192.168.10.2:3914 S / Padding,55760,3914,TCP,bad
2023-12-21 04:04:57,192.168.10.4,192.168.10.2,60,Ether / IP / TCP 192.168.10.4:55760 > 192.168.10.2:2013 S / Padding,55760,2013,TCP,bad
2023-12-21 04:04:57,192.168.10.4,192.168.10.2,60,Ether / IP / TCP 192.168.10.4:55760 > 192.168.10.2:printer S / Padding,55760,515,Printer,bad
2023-12-21 04:04:57,192.168.10.2,192.168.10.4,60,Ether / IP / TCP 192.168.10.2:27352 > 192.168.10.4:55760 RA / Padding,27352,55760,TCP,bad
2023-12-21 04:04:57,192.168.10.4,192.168.10.2,60,Ether / IP / TCP 192.168.10.4:55760 > 192.168.10.2:5801 S / Padding,55760,5801,TCP,bad
2023-12-21 04:04:57,192.168.10.2,192.168.10.4,60,Ether / IP / TCP 192.168.10.2:6543 > 192.168.10.4:55760 RA / Padding,6543,55760,TCP,bad
2023-12-21 04:04:57,192.168.10.2,192.168.10.4,60,Ether / IP / TCP 192.168.10.2:2021 > 192.168.10.4:55760 RA / Padding,2021,55760,TCP,bad
2023-12-21 04:04:57,192.168.10.4,192.168.10.2,60,Ether / IP / TCP 192.168.10.4:55760 > 192.168.10.2:6788 S / Padding,55760,6788,TCP,bad
2023-12-21 04:04:57,192.168.10.2,192.168.10.4,60,Ether / IP / TCP 192.168.10.2:2107 > 192.168.10.4:55760 RA / Padding,2107,55760,TCP,bad
2023-12-21 04:04:57,192.168.10.2,192.168.10.4,60,Ether / IP / TCP 192.168.10.2:5431 > 192.168.10.4:55760 RA / Padding,5431,55760,TCP,bad
2023-12-21 04:04:57,192.168.10.4,192.168.10.2,60,Ether / IP / TCP 192.168.10.4:55760 > 192.168.10.2:ms_sql_s S / Padding,55760,1433,Ms-SQL-S,bad
2023-12-21 04:04:57,192.168.10.2,192.168.10.4,60,Ether / IP / TCP 192.168.10.2:458 > 192.168.10.4:55760 RA / Padding,458,55760,TCP,bad
2023-12-21 04:04:57,192.168.10.4,192.168.10.2,60,Ether / IP / TCP 192.168.10.4:55760 > 192.168.10.2:7435 S / Padding,55760,7435,TCP,bad
2023-12-21 04:04:57,192.168.10.2,192.168.10.4,60,Ether / IP / TCP 192.168.10.2:nntps > 192.168.10.4:55760 RA / Padding,563,55760,NNTPS,bad
2023-12-21 04:04:57,192.168.10.2,192.168.10.4,60,Ether / IP / TCP 192.168.10.2:7911 > 192.168.10.4:55760 RA / Padding,7911,55760,TCP,bad
2023-12-21 04:04:57,192.168.10.4,192.168.10.2,60,Ether / IP / TCP 192.168.10.4:55760 > 192.168.10.2:21571 S / Padding,55760,21571,TCP,bad
2023-12-21 04:04:57,192.168.10.4,192.168.10.2,60,Ether / IP / TCP 192.168.10.4:55760 > 192.168.10.2:5560 S / Padding,55760,5560,TCP,bad
2023-12-21 04:04:57,192.168.10.4,192.168.10.2,60,Ether / IP / TCP 192.168.10.4:55760 > 192.168.10.2:4279 S / Padding,55760,4279,TCP,bad
2023-12-21 04:04:57,192.168.10.2,192.168.10.4,60,Ether / IP / TCP 192.168.10.2:30 > 192.168.10.4:55760 RA / Padding,30,55760,TCP,bad
2023-12-21 04:04:57,192.168.10.2,192.168.10.4,60,Ether / IP / TCP 192.168.10.2:dccm > 192.168.10.4:55760 RA / Padding,5679,55760,TCP,bad
2023-12-21 04:04:57,192.168.10.4,192.168.10.2,60,Ether / IP / TCP 192.168.10.4:55760 > 192.168.10.2:32779 S / Padding,55760,32779,TCP,bad
2023-12-21 04:04:57,192.168.10.2,192.168.10.4,60,Ether / IP / TCP 192.168.10.2:gopher > 192.168.10.4:55760 RA / Padding,70,55760,Gopher,bad
2023-12-21 04:04:57,192.168.10.2,192.168.10.4,60,Ether / IP / TCP 192.168.10.2:801 > 192.168.10.4:55760 RA / Padding,801,55760,TCP,bad
2023-12-21 04:04:57,192.168.10.4,192.168.10.2,60,Ether / IP / TCP 192.168.10.4:55760 > 192.168.10.2:1862 S / Padding,55760,1862,TCP,bad
2023-12-21 04:04:57,192.168.10.4,192.168.10.2,60,Ether / IP / TCP 192.168.10.4:55760 > 192.168.10.2:51103 S / Padding,55760,51103,TCP,bad
2023-12-21 04:04:57,192.168.10.4,192.168.10.2,60,Ether / IP / TCP 192.168.10.4:55760 > 192.168.10.2:9207 S / Padding,55760,9207,TCP,bad
2023-12-21 04:04:57,192.168.10.2,192.168.10.4,60,Ether / IP / TCP 192.168.10.2:3914 > 192.168.10.4:55760 RA / Padding,3914,55760,TCP,bad
2023-12-21 04:04:57,192.168.10.4,192.168.10.2,60,Ether / IP / TCP 192.168.10.4:55760 > 192.168.10.2:9500 S / Padding,55760,9500,TCP,bad
2023-12-21 04:04:57,192.168.10.2,192.168.10.4,60,Ether / IP / TCP 192.168.10.2:2013 > 192.168.10.4:55760 RA / Padding,2013,55760,TCP,bad
2023-12-21 04:04:57,192.168.10.4,192.168.10.2,60,Ether / IP / TCP 192.168.10.4:55760 > 192.168.10.2:1061 S / Padding,55760,1061,TCP,bad
2023-12-21 04:04:57,192.168.10.2,192.168.10.4,60,Ether / IP / TCP 192.168.10.2:printer > 192.168.10.4:55760 RA / Padding,515,55760,Printer,bad
2023-12-21 04:04:57,192.168.10.2,192.168.10.4,60,Ether / IP / TCP 192.168.10.2:5801 > 192.168.10.4:55760 RA / Padding,5801,55760,TCP,bad
2023-12-21 04:04:57,192.168.10.2,192.168.10.4,60,Ether / IP / TCP 192.168.10.2:6788 > 192.168.10.4:55760 RA / Padding,6788,55760,TCP,bad
2023-12-21 04:04:57,192.168.10.4,192.168.10.2,60,Ether / IP / TCP 192.168.10.4:55760 > 192.168.10.2:ms_olap2 S / Padding,55760,2394,TCP,bad
2023-12-21 04:04:57,192.168.10.2,192.168.10.4,60,Ether / IP / TCP 192.168.10.2:ms_sql_s > 192.168.10.4:55760 RA / Padding,1433,55760,Ms-SQL-S,bad
2023-12-21 04:04:57,192.168.10.2,192.168.10.4,60,Ether / IP / TCP 192.168.10.2:7435 > 192.168.10.4:55760 RA / Padding,7435,55760,TCP,bad
2023-12-21 04:04:57,192.168.10.4,192.168.10.2,60,Ether / IP / TCP 192.168.10.4:55760 > 192.168.10.2:1126 S / Padding,55760,1126,TCP,bad
2023-12-21 04:04:57,192.168.10.2,192.168.10.4,60,Ether / IP / TCP 192.168.10.2:21571 > 192.168.10.4:55760 RA / Padding,21571,55760,TCP,bad
2023-12-21 04:04:57,192.168.10.4,192.168.10.2,60,Ether / IP / TCP 192.168.10.4:55760 > 192.168.10.2:2009 S / Padding,55760,2009,TCP,bad
2023-12-21 04:04:57,192.168.10.4,192.168.10.2,60,Ether / IP / TCP 192.168.10.4:55760 > 192.168.10.2:3580 S / Padding,55760,3580,TCP,bad
2023-12-21 04:04:57,192.168.10.2,192.168.10.4,60,Ether / IP / TCP 192.168.10.2:5560 > 192.168.10.4:55760 RA / Padding,5560,55760,TCP,bad
2023-12-21 04:04:57,192.168.10.4,192.168.10.2,60,Ether / IP / TCP 192.168.10.4:55760 > 192.168.10.2:3 S / Padding,55760,3,TCP,bad
2023-12-21 04:04:57,192.168.10.2,192.168.10.4,60,Ether / IP / TCP 192.168.10.2:4279 > 192.168.10.4:55760 RA / Padding,4279,55760,TCP,bad
2023-12-21 04:04:57,192.168.10.2,192.168.10.4,60,Ether / IP / TCP 192.168.10.2:32779 > 192.168.10.4:55760 RA / Padding,32779,55760,TCP,bad
2023-12-21 04:04:57,192.168.10.4,192.168.10.2,60,Ether / IP / TCP 192.168.10.4:55760 > 192.168.10.2:49175 S / Padding,55760,49175,TCP,bad
2023-12-21 04:04:57,192.168.10.4,192.168.10.2,60,Ether / IP / TCP 192.168.10.4:55760 > 192.168.10.2:6565 S / Padding,55760,6565,TCP,bad
2023-12-21 04:04:57,192.168.10.4,192.168.10.2,60,Ether / IP / TCP 192.168.10.4:55760 > 192.168.10.2:1042 S / Padding,55760,1042,TCP,bad
2023-12-21 04:04:57,192.168.10.4,192.168.10.2,60,Ether / IP / TCP 192.168.10.4:55760 > 192.168.10.2:2126 S / Padding,55760,2126,TCP,bad
2023-12-21 04:04:57,192.168.10.2,192.168.10.4,60,Ether / IP / TCP 192.168.10.2:1862 > 192.168.10.4:55760 RA / Padding,1862,55760,TCP,bad
2023-12-21 04:04:57,192.168.10.2,192.168.10.4,60,Ether / IP / TCP 192.168.10.2:51103 > 192.168.10.4:55760 RA / Padding,51103,55760,TCP,bad
2023-12-21 04:04:57,192.168.10.2,192.168.10.4,60,Ether / IP / TCP 192.168.10.2:9207 > 192.168.10.4:55760 RA / Padding,9207,55760,TCP,bad
2023-12-21 04:04:57,192.168.10.2,192.168.10.4,60,Ether / IP / TCP 192.168.10.2:9500 > 192.168.10.4:55760 RA / Padding,9500,55760,TCP,bad
2023-12-21 04:04:57,192.168.10.2,192.168.10.4,60,Ether / IP / TCP 192.168.10.2:1061 > 192.168.10.4:55760 RA / Padding,1061,55760,TCP,bad
2023-12-21 04:04:57,192.168.10.2,192.168.10.4,60,Ether / IP / TCP 192.168.10.2:ms_olap2 > 192.168.10.4:55760 RA / Padding,2394,55760,TCP,bad
2023-12-21 04:04:57,192.168.10.2,192.168.10.4,60,Ether / IP / TCP 192.168.10.2:1126 > 192.168.10.4:55760 RA / Padding,1126,55760,TCP,bad
2023-12-21 04:04:57,192.168.10.2,192.168.10.4,60,Ether / IP / TCP 192.168.10.2:2009 > 192.168.10.4:55760 RA / Padding,2009,55760,TCP,bad
2023-12-21 04:04:57,192.168.10.2,192.168.10.4,60,Ether / IP / TCP 192.168.10.2:3580 > 192.168.10.4:55760 RA / Padding,3580,55760,TCP,bad
2023-12-21 04:04:57,192.168.10.2,192.168.10.4,60,Ether / IP / TCP 192.168.10.2:3 > 192.168.10.4:55760 RA / Padding,3,55760,TCP,bad
2023-12-21 04:04:57,192.168.10.2,192.168.10.4,60,Ether / IP / TCP 192.168.10.2:49175 > 192.168.10.4:55760 RA / Padding,49175,55760,TCP,bad
2023-12-21 04:04:57,192.168.10.2,192.168.10.4,60,Ether / IP / TCP 192.168.10.2:6565 > 192.168.10.4:55760 RA / Padding,6565,55760,TCP,bad
2023-12-21 04:04:57,192.168.10.2,192.168.10.4,60,Ether / IP / TCP 192.168.10.2:1042 > 192.168.10.4:55760 RA / Padding,1042,55760,TCP,bad
2023-12-21 04:04:57,192.168.10.2,192.168.10.4,60,Ether / IP / TCP 192.168.10.2:2126 > 192.168.10.4:55760 RA / Padding,2126,55760,TCP,bad
2023-12-21 04:04:57,192.168.10.4,192.168.10.2,60,Ether / IP / TCP 192.168.10.4:55760 > 192.168.10.2:2492 S / Padding,55760,2492,TCP,bad
2023-12-21 04:04:57,192.168.10.4,192.168.10.2,60,Ether / IP / TCP 192.168.10.4:55760 > 192.168.10.2:1028 S / Padding,55760,1028,TCP,bad
2023-12-21 04:04:57,192.168.10.4,192.168.10.2,60,Ether / IP / TCP 192.168.10.4:55760 > 192.168.10.2:pop2 S / Padding,55760,109,POP2,bad
2023-12-21 04:04:57,192.168.10.4,192.168.10.2,60,Ether / IP / TCP 192.168.10.4:55760 > 192.168.10.2:5902 S / Padding,55760,5902,TCP,bad
2023-12-21 04:04:57,192.168.10.4,192.168.10.2,60,Ether / IP / TCP 192.168.10.4:55760 > 192.168.10.2:8400 S / Padding,55760,8400,TCP,bad
2023-12-21 04:04:57,192.168.10.4,192.168.10.2,60,Ether / IP / TCP 192.168.10.4:55760 > 192.168.10.2:4004 S / Padding,55760,4004,TCP,bad
2023-12-21 04:04:57,192.168.10.4,192.168.10.2,60,Ether / IP / TCP 192.168.10.4:55760 > 192.168.10.2:5862 S / Padding,55760,5862,TCP,bad
2023-12-21 04:04:57,192.168.10.4,192.168.10.2,60,Ether / IP / TCP 192.168.10.4:55760 > 192.168.10.2:8994 S / Padding,55760,8994,TCP,bad
2023-12-21 04:04:57,192.168.10.4,192.168.10.2,60,Ether / IP / TCP 192.168.10.4:55760 > 192.168.10.2:32774 S / Padding,55760,32774,TCP,bad
2023-12-21 04:04:57,192.168.10.4,192.168.10.2,60,Ether / IP / TCP 192.168.10.4:55760 > 192.168.10.2:10778 S / Padding,55760,10778,TCP,bad
2023-12-21 04:04:57,192.168.10.4,192.168.10.2,60,Ether / IP / TCP 192.168.10.4:55760 > 192.168.10.2:finger S / Padding,55760,79,Finger,bad
2023-12-21 04:04:57,192.168.10.2,192.168.10.4,60,Ether / IP / TCP 192.168.10.2:2492 > 192.168.10.4:55760 RA / Padding,2492,55760,TCP,bad
2023-12-21 04:04:57,192.168.10.4,192.168.10.2,60,Ether / IP / TCP 192.168.10.4:55760 > 192.168.10.2:1081 S / Padding,55760,1081,TCP,bad
2023-12-21 04:04:57,192.168.10.2,192.168.10.4,60,Ether / IP / TCP 192.168.10.2:1028 > 192.168.10.4:55760 RA / Padding,1028,55760,TCP,bad
2023-12-21 04:04:57,192.168.10.4,192.168.10.2,60,Ether / IP / TCP 192.168.10.4:55760 > 192.168.10.2:14442 S / Padding,55760,14442,TCP,bad
2023-12-21 04:04:57,192.168.10.4,192.168.10.2,60,Ether / IP / TCP 192.168.10.4:55760 > 192.168.10.2:1164 S / Padding,55760,1164,TCP,bad
2023-12-21 04:04:57,192.168.10.4,192.168.10.2,60,Ether / IP / TCP 192.168.10.4:55760 > 192.168.10.2:32784 S / Padding,55760,32784,TCP,bad
2023-12-21 04:04:57,192.168.10.4,192.168.10.2,60,Ether / IP / TCP 192.168.10.4:55760 > 192.168.10.2:4662 S / Padding,55760,4662,TCP,bad
2023-12-21 04:04:57,192.168.10.4,192.168.10.2,60,Ether / IP / TCP 192.168.10.4:55760 > 192.168.10.2:8002 S / Padding,55760,8002,TCP,bad
2023-12-21 04:04:57,192.168.10.2,192.168.10.4,60,Ether / IP / TCP 192.168.10.2:pop2 > 192.168.10.4:55760 RA / Padding,109,55760,POP2,bad
2023-12-21 04:04:57,192.168.10.4,192.168.10.2,60,Ether / IP / TCP 192.168.10.4:55760 > 192.168.10.2:5002 S / Padding,55760,5002,RFE,bad
2023-12-21 04:04:57,192.168.10.2,192.168.10.4,60,Ether / IP / TCP 192.168.10.2:5902 > 192.168.10.4:55760 RA / Padding,5902,55760,TCP,bad
2023-12-21 04:04:57,192.168.10.2,192.168.10.4,60,Ether / IP / TCP 192.168.10.2:8400 > 192.168.10.4:55760 RA / Padding,8400,55760,TCP,bad
2023-12-21 04:04:57,192.168.10.4,192.168.10.2,60,Ether / IP / TCP 192.168.10.4:55760 > 192.168.10.2:cmd S / Padding,55760,514,Shel,bad
2023-12-21 04:04:57,192.168.10.2,192.168.10.4,60,Ether / IP / TCP 192.168.10.2:4004 > 192.168.10.4:55760 RA / Padding,4004,55760,TCP,bad
2023-12-21 04:04:57,192.168.10.2,192.168.10.4,60,Ether / IP / TCP 192.168.10.2:5862 > 192.168.10.4:55760 RA / Padding,5862,55760,TCP,bad
2023-12-21 04:04:57,192.168.10.4,192.168.10.2,60,Ether / IP / TCP 192.168.10.4:55760 > 192.168.10.2:1875 S / Padding,55760,1875,TCP,bad
2023-12-21 04:04:57,192.168.10.2,192.168.10.4,60,Ether / IP / TCP 192.168.10.2:8994 > 192.168.10.4:55760 RA / Padding,8994,55760,TCP,bad
2023-12-21 04:04:57,192.168.10.2,192.168.10.4,60,Ether / IP / TCP 192.168.10.2:32774 > 192.168.10.4:55760 RA / Padding,32774,55760,TCP,bad
2023-12-21 04:04:57,192.168.10.4,192.168.10.2,60,Ether / IP / TCP 192.168.10.4:55760 > 192.168.10.2:3168 S / Padding,55760,3168,TCP,bad
2023-12-21 04:04:57,192.168.10.2,192.168.10.4,60,Ether / IP / TCP 192.168.10.2:10778 > 192.168.10.4:55760 RA / Padding,10778,55760,TCP,bad
2023-12-21 04:04:57,192.168.10.4,192.168.10.2,60,Ether / IP / TCP 192.168.10.4:55760 > 192.168.10.2:10010 S / Padding,55760,10010,TCP,bad
2023-12-21 04:04:57,192.168.10.4,192.168.10.2,60,Ether / IP / TCP 192.168.10.4:55760 > 192.168.10.2:2040 S / Padding,55760,2040,TCP,bad
